{
  "contract": "transformer-flight",
  "version": 4,
  "requestId": "23232323-2323-4232-8232-232323232323",
  "jobId": "34343434-3434-4343-8343-343434343434",
  "operation": "predict",
  "revision": 1,
  "input": {"state": "OPEN", "revision": 0, "nextOrdinal": 0},
  "execution": {"state": "WAITING_INPUT"},
  "ownership": {
    "clientExecutionId": "45454545-4545-4454-8454-454545454545",
    "fencingToken": "1"
  },
  "device": {"requested": "auto", "selected": null},
  "resolvedModelRef": "mdl_01j2x5f4x6h7k8m9n0p1q2r3s4",
  "dataContract": {
    "id": "inventory.learning-dataset",
    "version": 1,
    "dataContractSha256": "aaaaaaaaaaaaaaaaaaaaaaaaaaaaaaaaaaaaaaaaaaaaaaaaaaaaaaaaaaaaaaaa",
    "seqLen": 2,
    "featureDim": 2,
    "targetSchemaId": "inventory.target.v1"
  },
  "mlContract": {
    "targetSchemaId": "inventory.target.v1",
    "predictionSchemaId": "transformer.prediction.target-aligned.v1",
    "objectiveId": "transformer.objective.target-aligned.v1",
    "objectiveConfigSha256": "70ccf944fa5aa94f8e51836c28b105779d17cc660ecf88c608cca9ebe171866a",
    "checkpointFormat": "transformer-checkpoint-v3",
    "targetWidth": 6,
    "predictionSpace": "target"
  },
  "limits": {
    "maxMessageBytes": 16777216,
    "targetBatchBytes": 8388608,
    "maxBatchBytes": 16777216,
    "maxPayloadBytes": 536870912,
    "maxRowsPerPayload": 2000000,
    "maxPayloadsPerJob": 100000,
    "maxJobBytes": 68719476736,
    "maxActiveJobsPerSubject": 32,
    "maxPageItems": 100,
    "inputIdleTimeoutSeconds": 900.0,
    "transportMessageLimitEnforced": false
  },
  "upload": {
    "descriptorPath": [
      "transformer", "v4", "jobs",
      "34343434-3434-4343-8343-343434343434", "inputs", "{ordinal}"
    ],
    "schemaId": "inventory.sequence.predict.v2",
    "oneDoPutIsOneSemanticPayload": true
  }
}
